Title,Link,Description
"[제12회 어린이안전대상-대상(대통령상)│세종시] 시민·어린이, 안전도시 만...",http://www.naeil.com/news_view/?id_art=445552,"신도심 내 신설예정인 유·초교 설계에 세종시와 교육청, 경찰청, 행복청, LH가 참여해 승하차구역을... [관련기사] ▶ 세종시, 어린이안전대상 대통령상 ▶ [제12회 어린이안전대상-본상(국무총리상)│전남 해남군]... "
[제12회 어린이안전대상-본상(행정안전부장관상)│서울특별시 노원구] 아픈 아...,http://www.naeil.com/news_view/?id_art=445554,"지난 2019년 5월 전국 지자체 가운데 처음으로 관련 조례를 제정하고 경찰서와 협약, 아동보호협업체계를... (국무총리상)│전남 해남군] 안전체험 탐방단 활동 5년간 이어와 ▶ [제12회 어린이안전대상-본상... "
[제12회 어린이안전대상-본상(행정안전부장관상)│경기도 안양시] &apos;인공지능+...,http://www.naeil.com/news_view/?id_art=445555,지난 7월엔 경찰청이 안양시를 첨단 ICT교차로 표준모델 시범운영 지지체로 선정하기도 했다. 최대호... (국무총리상)│전남 해남군] 안전체험 탐방단 활동 5년간 이어와 ▶ [제12회 어린이안전대상-본상... 
농민 속여 태양광 발전시설 계약금 가로챈 일당 검찰송치,https://n.news.naver.com/mnews/article/277/0005193837?sid=102,전남경찰청 반부패·경제범죄수사1대는 특정경제범죄가중처벌법상 사기 혐의로 A씨 등 13명을 구속해 검찰에 송치했다고 19일 밝혔다. 경찰은 사기 범죄에 가담한 18명도 같은 혐의로 불구속 입건했다. A씨 등은... 
광주 13살 정창현군 실종... “키 151㎝·몸무게 36㎏ 마른 체격”,https://idsn.co.kr/news/view/1065581089032916,시민분들은 경찰(182)에 곧바로 연락을 부탁드린다”고 당부했다. 광주에서는 지난 17일부터 사흘간 최대 18.8㎝(남구 노대동)의 눈이 내리는 등 폭설이 이어지고 있다. 광주시·전남도교육청에 따르면 이날 광주 지역 학교... 
집값 하락은 ‘증여성 직거래’ 기회?,https://n.news.naver.com/mnews/article/016/0002080007?sid=101,"지방에서는 대구의 증여 비중이 11.9%로 서울 다음으로 높았고 제주(11.8%), 전남(11.7%), 대전(9.9%)이 뒤를... 등 위법의심행위에 대해선 국세청, 경찰청, 지방자치단체 등 관계기관에 통보해 엄중 조치할 방침이다."
나주에 &apos;우회전 신호등&apos; 첫 등장…&quot;얌체 운전자 사라지길&quot;,https://n.news.naver.com/mnews/article/003/0011598205?sid=102,"기사내용 요약 나주경찰서, 지난 8월부터 지역내 12곳서 21개 운영 중 내년 도로교통법 개정 시행규칙 앞두고... &quot; 지난 16일 오전 전남 나주 혁신도시 한 삼거리. 횡단보도 초록불이 일제히 켜지면서 보행신호를 기다리던... "
전남 광주 폭설 속 10대 중학생 사흘째 행방 묘연…&quot;실종경보 발령&quot;,https://www.jejutwn.com/news/article.html?no=156327,대설특보가 내린 광주광역시에서 10대 중학생이 실종돼 경찰이 수색에 나섰다. 19일 경찰에 따르면 광주북부경찰서는 광주 북구 일곡마을로에서 실종된 중학생 정창현(13)군에 대한 실종경보를 발령했다. 경찰은 주거지... 
"해경, 전남 도서지역 응급환자 3명 이송",https://www.gukjenews.com/news/articleView.html?idxno=2617263,"사진제공=목포해양경찰 해경이 지난 주말 전남 도서지역에서 발생한 응급환자 3명을 육지로 이송했다. 19일 목포해경에 따르면 18일 오후 4시 34분께 신안군 도초도에서 주민 A씨(50대, 남)가 글라인더 작업 중 손을... "
"광주·전남, 눈길 빙판길 사고 잇따라...&apos;미끄러지고 넘어지고&apos;",https://idsn.co.kr/news/view/1065576773062994,19일 경찰과 소방당국에 따르면 이날 오전에만 광주·전남에서 보행자 낙상사고 8건이 발생한 것으로 잠정 집계됐다. 이날 오전 8시 37분경 광주 북구 오치동의 한 거리에서 목욕탕에 가던 60대 남성이 눈길에 미끄러져... 
[19일 오늘의사건사고] 전남 구례군 지리산 일대서 산불 등,https://idsn.co.kr/news/view/1065576981017848,19일 전남 구례군 마산면 황전리 지리산 국립공원 일대에서 산불이 발생한 가운데 광주광역시 동구와 전남... 한편 경찰은 빙판길에 차가 미끄러져 사고가 난 것으로 보고 정확안 사고 경위 등을 조사하고 있다
광주-화순 너릿재터널서 차량 3중 추돌 사고,https://n.news.naver.com/mnews/article/421/0006526579?sid=102,19일 오전 8시53분쯤 광주와 전남 화순을 연결하는 신너릿재 터널에서 차량 3중 추돌 사고가 발생했다.... 들이받으며 연속 추돌사고가 발생한 것으로 알려졌다. 경찰은 운전자를 상대로 정확한 사고 경위를 조사하고 있다.
&quot;태양광 시설 설치&quot;로 175억 가로챈 사기단 검거,https://www.jnilbo.com/view/media/view?code=2022121910201274382,태양광 발전 시설 설치 명목으로 거액의 계약금만 받아 도주한 사기단이 무더기 검거됐다.19일 전남경찰청 반부패경제범죄수사1대는 최근 태양광 발전시설 설치 사업을 허위로 꾸며 계약금만 가로챈 혐의(특정경제범... 
"광주·전남 사흘째 대설특보, 도로·뱃길 통제…빙판길 낙상사고 잇따라",http://www.namdonews.com/news/articleView.html?idxno=707589,광주·전남에 사흘째 눈이 내려 일부 도로와 뱃길이 통제되는가 하면 차량과 보행자들의 눈길 빙판길... 경찰과 소방당국에 따르면 이날 오전 8시 37분께 광주 북구 오치동 한 거리에서 목욕탕에 가던 60대 남성이... 
[17일 오늘의사건사고] 제주 서구포항 인근서 37톤급 연승어선 좌초 사고 등,https://idsn.co.kr/news/view/1065574245938878,한편 경찰은 정확한 사고 원인을 조사하고 있다. ◆목포서 중앙선 넘은 SUV가 승용차와 충돌...2명 경상 17일 저녁 6시 40분경  전남 목포시 상동 편도 2차로에서 SUV 한 대가 중앙선을 넘어 마주 오던 승용차와 충돌했다.... 
&apos;밀리고 넘어지고&apos; 광주·전남 빙판길 사고 잇따라,https://n.news.naver.com/mnews/article/001/0013649038?sid=102,사흘째 많은 눈이 내린 광주·전남에서는 차량과 보행자들의 눈길 빙판길 미끄러짐 사고가 이어졌다. 19일 경찰과 소방당국에 따르면 이날 오전 8시 37분께 광주 북구 오치동 한 거리에서 목욕탕에 가던 60대 남성이... 
광주·화순 너릿재터널 차량 3대 연쇄 추돌…출근길 교통 정체,https://n.news.naver.com/mnews/article/016/0002079828?sid=102,전남 화순군을 잇는 도로의 신너릿재 터널 안에서 차량 3대가 잇따라 부딪히는 사고가 발생했다. 차량 연쇄 추돌사고로 출근길 도로가 다소 정체 현상을 빚었지만 인명피해는 발생하지 않은 것으로 파악됐다. 경찰은... 
광주-화순 너릿재터널 빙판길 차량 3대 연쇄 추돌,https://n.news.naver.com/mnews/article/001/0013648952?sid=102,"전남 화순군을 잇는 도로의 신너릿재 터널 안에서 차량 3대가 잇따라 부딪히는 사고가 발생했다. 눈과 비가 얼면서 차량이 미끄러진 것으로 보이며, 심각한 인명피해는 발생하지 않은 것으로 알려졌다. 신고를 받은 경찰... "
전남경찰 &apos;태양광 사기단&apos; 검거..13명 구속,https://mpmbc.co.kr/article/Y7eT6dFfnSCpP7,전남경찰청은 농민들을 상대로 태양광발전시설 설치 사기행각을 벌인 31명을 붙잡아 이가운데 13명을 구속했습니다. 이들은 지난 2020년부터 고령의 농민들에게 접근해 태양광발전시설로 고소득이 보장된다고 속인 뒤... 
"국립 순천대-전라남도자치경찰위원회, &apos;연구·학술교류&apos; 업무협약",https://www.newsway.co.kr/news/view?tp=1&ud=2022121820131613799,"이날 대학본부에서 열린 협약식에 순천대는 고영진 총장, 인공지능공학부 신창선 교수, 지능기술연구소 김용규, 김광심 교수가 참석했고, 전남자치경찰위원회에서는 조만형 위원장, 백혜웅 사무국장, 박송희... "
[농민칼럼] 2022년을 살아낸 농촌은 지금,http://www.ikpnews.net/news/articleView.html?idxno=49379,정영이(전남 구례) 어느 해인들 곡절 없이 여유로웠던 세월이 있었을까만 2022년 한 해는 자다가도 벌떡... 백남기 농민이 돌아가시고 부검을 하겠다는 정부와 경찰에 맞서 서울대병원 장례식장을 사수했던 하루하루는... 
대설주의보 광주시 전 직원 눈치우기 활동…&quot;오전 10시까지 출근&quot;,https://n.news.naver.com/mnews/article/421/0006525995?sid=102,"앞서 전날 광주시는 5개 구청과 소방본부, 경찰청 등과 함께 긴급 제설을 위한 관계기관 회의를 진행... 한편 광주와 전남지역 19일 오전 6시 기준 적설량은 영광군 18.4㎝, 무안 해제 17.9㎝, 신안 압해 16.8㎝, 함평 월야 15.... "
[오늘의 주요 일정] &apos;사법행정권 남용&apos; 임종헌 전 법원행정처 차장 공판,http://www.safetimes.co.kr/news/articleView.html?idxno=116915,"행안부, 경찰 조직·인사 제도 개선방안 브리핑(10:00 정부서울청사 별관) ▲ 행안부, 공기업정책위원회... 김영록 전남지사 11:10 전남행복지역화폐 광역플랫폼 구축 업무협약(VIP실) 14:00 전라남도 정책자문위원... "
화물연대의 백기 투항 이끌어낸 원희룡 국토교통부 장관 | “이제 시작… 5년...,http://monthly.chosun.com/client/news/viw.asp?ctcd=E&nNewsNumb=202301100016,"2일, 전남 광양시 광양항에 반출 안 된 컨테이너들이 쌓여 있다. 화물연대가 집단적으로 운송을 거부한 16일... “이번에 새총을 쏘고, 차량을 검문·검색하고, 사진을 찍는 행태에 대해 경찰이 강하게 대응했어요.... "
찻길·뱃길·하늘길 ‘꽁꽁’… 전국 곳곳 동파·교통사고 속출,https://n.news.naver.com/mnews/article/022/0003765686?sid=102,대설·한파 피해 잇따라 제주공항 470편 중 6편만 정상 운항 18일 오전 기준 최대 30㎝가량 눈 전남·전북 등... 경찰 등에 따르면 서울 수서경찰서는 40대 버스기사 A씨를 교통사고처리특례법상 과실치사 혐의로 입건해... 
농민 등친 태양광 사기단 &apos;덜미&apos;,http://www.pinpointnews.co.kr/news/articleView.html?idxno=162644,전남경찰청 표지석. 사진=전남경찰청 태양광 발전시설 설치 계약금 명목으로 전국의 농민에게 거액을 가로챈 사기단이 잡혔다. 전남경찰청 반부패·경제범죄수사1대는 전날 A씨 등 13명을 특정경제범죄가중처벌법상... 
"태양광에 &apos;피눈물&apos; 흘린 농심..전남경찰, 전국 854명·175억 피해 사기단 검거",http://kpenews.com/View.aspx?No=2665196,19일 경찰청에 따르면 지난 18일 전남경찰청 반부패·경제범죄수사1대는 특정경제범죄 가중처벌법상 사기 혐의로 조직책 A 씨 등 13명을 구속해 검찰에 송치했다. A 씨 등은 태양광 발전시설 설치 능력이 없는 업체를... 
“태양광 설치하면 연소득 3000만원”...연로한 농민에게 175억 뜯은 사기단,https://n.news.naver.com/mnews/article/021/0002546959?sid=102,전남경찰청 반부패경제범죄수사1대는 특정경제범죄가중처벌법상 사기 혐의로 40대 A 씨 등 13명을 구속해 검찰에 송치했다고 18일 밝혔다. 경찰은 사기 범죄에 가담한 18명도 같은 혐의로 불구속 입건했다. A 씨 일당은... 
태양광 설치 주의보…계약금 175억 가로챈 사기단 검거,https://n.news.naver.com/mnews/article/005/0001574037?sid=102,전남경찰청 반부패경제범죄수사1대는 특정경제범죄가중처벌법상 사기 혐의로 A씨 등 13명을 구속해 검찰에 송치했다고 18일 밝혔다. 또 이들의 사기 범죄에 가담한 18명도 같은 혐의로 불구속 입건했다. 이들은... 
폭설에 막힌 호남·제주 교통편…피해도 잇따라,https://n.news.naver.com/mnews/article/215/0001072120?sid=102,"전남에서는 여객선 전 항로 운항이 중단됐고, 전북에서도 군산∼어청도와 군산∼석도 등을 오가는 4개... 이에 이 영화관 1층이 한때 통제됐고 경찰이 전문가와 현장을 살펴본 결과 기온이 급격히 떨어져 로비 바닥의... "
총경 승진인사 지연..광주·전남경찰 &apos;뒤숭숭&apos;,https://n.news.naver.com/mnews/article/660/0000024309?sid=102,"예년보다 늦어지고 있는 총경 승진 인사를 앞두고 광주·전남경찰의 분위기가 뒤숭숭합니다. 광주와 전남경찰들은 새 정부 들어 복수직급제 확대와 순경 출신 고위직 비율 확대 등 변수가 많아진데다, 통상 매년 12월... "
호남·제주 폭설에 막힌 하늘·바닷길…사고도 속출(종합2보),https://n.news.naver.com/mnews/article/001/0013648628?sid=102,"전남에서는 여객선 전 항로 운항이 중단됐고, 전북에서도 군산∼어청도와 군산∼석도 등을 오가는 4개... 이에 이 영화관 1층이 한때 통제됐고 경찰이 전문가와 현장을 살펴본 결과 기온이 급격히 떨어져 로비 바닥의... "
전남경찰 &apos;태양광 사기단&apos; 검거..13명 구속,https://mpmbc.co.kr/article/Kl0FpZTMgx7WNp,전남경찰청은 농민들을 상대로 태양광발전시설 설치 사기행각을 벌인 31명을 붙잡아 이가운데 13명을 구속했습니다. 이들은 지난 2020년부터 고령의 농민들에게 접근해 태양광발전시설로 고소득이 보장된다고 속인 뒤... 
태양광 설치 계약금 명목으로 농민 등친 사기단…피해자 854명,https://n.news.naver.com/mnews/article/088/0000789197?sid=102,전남경찰청 반부패·경제범죄수사1대는 특정경제범죄가중처벌법상 사기 혐의로 A씨 등 13명을 구속해 검찰에 송치했다고 18일 밝혔다. 경찰은 사기 범죄에 가담한 18명도 같은 혐의로 불구속 입건했다. 경찰에 따르면... 
한라산 32㎝ 폭설... 제주 항공편 100편 결항,https://n.news.naver.com/mnews/article/023/0003735305?sid=102,경찰은 “내리막길 도로를 주행하던 차량이 눈길에 미끄러지면서 사고가 난 것으로 보인다”고 했다.... 또 18일 오전 5시 58분쯤 전남 보성군 벌교읍에서 차량이 눈길에 미끄러져 운전자가 부상을 입었다. 전북... 
얼어붙은 대한민국‥폭설에 하늘길 뱃길 막혀,https://n.news.naver.com/mnews/article/214/0001242114?sid=102,"◀ 기자 ▶ 네, 눈구름띠가 이곳 제주부터 충청, 전남 서부지역을 중심으로 걸쳐 있는데요. 이틀째 눈보라가... [경찰관계자] &quot;눈길에 미끄러지며 건물 외벽을 충격한 단독 사고입니다. 운전자 음주 여부 등 정확한 사고... "
태양광 설치 계약금 175억 챙긴 일당 검거,http://www.kwangju.co.kr/article.php?aid=1671361200746790006,전남경찰청 반부패경제범죄수사1대는 해남·고흥 등 전남지역 농민 300여명을 포함해 전국 농민 854명에게 태양광시설 설치 계약금을 받아 챙긴 일당의 총책 A씨 등 31명을 특정경제범죄가중처벌 등에 관한 법률 위반... 
&quot;태양광 설치하면 年3천만원 수익&quot; 노인들 속여 175억 가로챘다,https://n.news.naver.com/mnews/article/008/0004830287?sid=102,전남경찰청 태양광발전시설 설치계약금 175억원을 가로챈 혐의 등으로 총책 40대 A씨 등 31명을 검거하고 그 중 13명을 구속 송치했다고 18일 밝혔다. A씨 일당은 지난 2020년부터 태양광시설 제조업체 유령 법인 4곳을... 
전남자치경찰위·마을공동체 협업 강화,http://www.kjdaily.com/article.php?aid=1671360015591328002,"실무협의회에선 전남도, 전남경찰청, 국토관리사무소, 도로관리사업소 등 관계자 12명이 참석한 가운데 교통·생활안전·여성청소년 분야에서 유관기관 간 협력이 필요한 6건의 안건을 협의했다. 주요 안건은 ▲시·군... "
폭설·한파 몰아친 광주·전남 교통 통제·사고 속출,http://www.kjdaily.com/article.php?aid=1671360003591327002,"/김애리 기자휴일 이틀 동안 최대 20㎝가 넘는 폭설에 한파가 몰아친 광주·전남 지역에서 각종 교통사고가... 광주시와 5개 자치구 부구청장, 소방본부와 광주경찰청 관계자들은 이날 긴급 제설을 위한 관계 기관... "
태양광발전소 계약금 175억 편취 범죄조직 검거,http://www.kjdaily.com/article.php?aid=1671360018591312005,18일 전남경찰청에 따르면 전국 농민 854명을 대상으로 유령법인을 4차례 바꿔가며 태양광발전소 설치계약금 175억을 편취한 악성사기 조직 총책 A씨 등 31명을 지난 16일 검거했다. 이중 13명은 구속 송치했다. 총책 A씨... 
"경찰, 농민 상대로 175억 원 가로챈 ‘태양광 사기단’ 검거",https://n.news.naver.com/mnews/article/020/0003468663?sid=102,전남경찰청 반부패·경제범죄수사1대는 18일 태양광발전시설 설치 계약금 175억 원을 가로챈 혐의(특정경제범죄가중처벌법상 사기)로 A 씨(44) 등 31명을 검거하고 이중 13명은 구속 송치했다고 밝혔다. 이들은 2020년부터... 
"전남자치경찰위, 4차 실무협의회 개최 ‘마을공동체와 협업’ 강화",http://www.breaknews.com/939017,"(사진) 실무협의회에선 전남도, 전남경찰청, 국토관리사무소, 도로관리사업소 등 관계자 12명이 참석한 가운데 교통․생활안전․여성청소년 분야에서 유관기관 간... "
"광주시, 과장급 이상 간부공무원 대상 4대 폭력 예방교육",http://www.breaknews.com/939022,교육은 폭력예방교육 전문강사인 김향화 경찰인재개발원 성평등정책담당... establish and enforce the ‘Safe City Gwangju’ policy.” ”he said. 원본 기사 보기:브레이크뉴스 전남
"강기정 광주시장, “시민불편 최소화 위해 제설 철저” 주문",http://www.breaknews.com/939043,"한편, 문영훈 행정부시장은 18일 오전 5개 자치구 부구청장과 경찰, 소방 합동... depending on the weather conditions on the night of the 18th. 원본 기사 보기:브레이크뉴스 전남"
[독자투고]경찰민원을 가장한 &apos;스미싱&apos; 속지 않는 게 최선의 예방책,http://www.namdonews.com/news/articleView.html?idxno=707555,김정원 전남 장흥경찰서 교통관리계 요즘 휴대전화는 개개인의 신분증처럼 보편적으로 소지하고 있다. 문제는 현대인들의 편리함과 다양함을 제공해주는 이런 휴대전화를 이용하여 보이스피싱 등 다양한 범죄가... 
골프장서 지갑 훔치고 부하 성추행까지…경찰 왜 이러나,http://www.namdonews.com/news/articleView.html?idxno=707541,"18일 광주·전남경찰청에 따르면, 나주경찰은 골프장 탈의실 사물함에서 금품을 훔친 혐의(절도)로 광주 서부경찰서 모 지구대 A경사를 입건했다. A경사는 지난 13일 낮 12시 30분께 나주시 한 골프장 탈의실 사물함에서... "
남도일보 2022사회분야 10대 뉴스 (6) 5·18 암매장 진실 첫 확인,http://www.namdonews.com/news/articleView.html?idxno=707554,"군과 경찰, 5월단체 등이 합동 감식을 벌였다. /5·18기념재단 제공 42년 간 베일에 가려있던 5·18민주화운동... ◇암매장 진실 최초 확인 해당 유골로 확인된 신원은 전남 화순에서 태어난 80년 당시 만 23살 청년... "
태양광 시설 설치 미끼 농민 등친 일당 검거,http://www.namdonews.com/news/articleView.html?idxno=707550,전남경찰청 전경 농민 수백명을 상대로 태양광 발전시설 설치를 약속 한 뒤 계약금 명목으로 거액을 가로채 달아난 일당이 경찰에 붙잡혔다. 전남경찰청 반부패·경제범죄수사1대는 특정경제범죄가중처벌법상 사기... 
"&apos;태양광 사기단&apos; 검거, 농민 상대로 175억 뜯어내…13명 검찰 송치",https://www.etoday.co.kr/news/view/2203890,18일 전남경찰청 반부패·경제범죄수사1대는 특정경제범죄가중처벌법상 사기 혐의로 총책 A(44)씨 등 13명을 검거해 송치했다고 밝혔다. 경찰은 범죄에 가담한 18명도 같은 혐의로 불구속 입건했다. 총 31명이 같은 혐의로... 
꽁꽁 언 찻길·뱃길·하늘길… 전국 곳곳 동파·교통사고 속출,https://n.news.naver.com/mnews/article/022/0003765560?sid=102,"경찰 조사 결과 A씨는 사고 당시 음주나 신호위반을 하지는 않은 것으로 파악됐다. 이날 정오 당시 전남권 서부와 제주도, 울릉도, 독도에 대설특보가 발효상태였으며, 강원 미시령 옛길, 충남 질고개, 전남 두목재 등... "
"&quot;854명, 175억원 피해&quot;…태양광 사기단 붙잡혀",https://n.news.naver.com/mnews/article/215/0001072112?sid=102,전남경찰청 반부패·경제범죄수사1대는 특정경제범죄가중처벌법상 사기 혐의로 A씨 등 13명을 구속해 검찰에 송치했다고 18일 밝혔다. 경찰은 사기 범죄에 가담한 18명도 같은 혐의로 불구속 입건했다. 경찰에 따르면... 
폭설 내린 제주·호남 항공편 결항하고 눈 피해 속출,https://n.news.naver.com/mnews/article/422/0000575149?sid=161,"굵은 눈발이 그칠 줄 모르자, 경찰이 차량 통행을 통제합니다. &lt;현장음&gt; &quot;서귀포 갈 거죠? 서귀포는 못 가요.... 폭설로 광주 전남지역에선 빙판길 미끄러짐 사고를 비롯해 크고 작은 교통사고가 잇따른 가운데, 눈은 19일... "
농민 등친 태양광 설치 사기단 31명 검거...&apos;13명 구속&apos;,https://n.news.naver.com/mnews/article/469/0000713486?sid=102,전남경찰청 반부패·경제범죄수사1대는 &quot;태양광발전시설 설치 계약금 175억 원을 가로챈 혐의(특정경제범죄가중처벌법상 사기)로 A씨 등 13명을 구속해 검찰에 송치했다&quot;고 18일 밝혔다. 또 유령법인을 내세워 범죄에... 
‘계약금 10%’ 미끼 854명에 175억원 뜯어낸 태양광사기단,https://n.news.naver.com/mnews/article/277/0005193531?sid=102,전남경찰청 반부패·경제범죄수사1대는 18일 특정경제범죄가중처벌법상 사기 혐의로 A씨 등 13명을 구속해 검찰에 송치했다고 밝혔다. 경찰은 사기 범죄에 가담한 18명도 같은 혐의로 불구속 입건했다. 경찰에 따르면... 
"전남경찰, 농민 속여 175억 챙긴 태양광발전 사기 일당 검거",http://www.kukinews.com/newsView/kuk202212180033,"전남경찰청은 18일, 유령법인을 4차례나 바꿔가며 전국 농민 854명으로부터 태양광발전시설 설치계약금 175여억 원을 챙긴 악성사기 조직 총책 A씨 등 31명을 검거, 지난 16일 13명을 구속 송치했다고 밝혔다. 총책 A씨... "
경찰 범법행위 잇따라…기강해이 또다시 &apos;도마&apos;,http://www.jndn.com/article.php?aid=1671354081351045005,18일 광주·전남경찰청에 따르면 나주경찰은 골프장 탈의실 사물함에서 금품을 훔친 혐의(절도)로 서부서 모 지구대 A경사를 입건했다. A경사는 지난 13일 오후 나주시 한 골프장 탈의실 사물함에서 현금·수표 700만 원이... 
비번 훔쳐본 뒤…현직 경찰이 골프장 &apos;탈의실&apos;에서 저지른 한심한 범죄 수준,https://www.wikitree.co.kr/articles/816358,골프장 탈의실에서 지갑을 훔친 현직 경찰이 붙잡혔다.전남 나주경찰서는 지난 16일 절도 혐의로 40대 경사 A 씨를 불구속 입건됐다고 밝혔다.A 경사는 지난 13일 전남 나주시 남평읍의 한 골프장 탈의실 옷장에서 701만... 
전남서 검거된 ‘태양광 사기단’… 854명에게 175억원 뜯어내,https://n.news.naver.com/mnews/article/366/0000863104?sid=102,18일 전남경찰청 반부패·경제범죄수사1대는 특정경제범죄가중처벌법상 사기 혐의로 A씨 등 13명을 구속해 검찰에 송치했다고 밝혔다. 경찰은 사기 범죄에 가담한 18명도 같은 혐의로 불구속 입건했다. 경찰에 따르면... 
"전남경찰, 고소득 미끼로 수백억 가로챈 태양광 사기단 검거",https://n.news.naver.com/mnews/article/079/0003718436?sid=102,전남경찰청 반부패·경제범죄수사1대는 특정경제범죄가중처벌법상 사기 혐의로 A씨 등 13명을 구속해 검찰에 송치했다고 18일 밝혔다. 경찰은 사기 범죄에 가담한 18명도 같은 혐의로 불구속 입건했다. A씨 등은 설치... 
&quot;농민들 속여 175억 가로채&quot;…태양광 발전시설 사기단 검거,https://n.news.naver.com/mnews/article/015/0004788767?sid=102,전남경찰청 반부패·경제범죄수사1대는 특정경제범죄가중처벌법상 사기 혐의로 A씨 등 13명을 구속해 검찰에 송치했다고 18일 밝혔다. 경찰은 사기 범죄에 가담한 18명도 같은 혐의로 불구속 입건했다. 해당 사기단은... 
