Title,Link,Description
"한국해양교통학회, 2022년 추계학술대회 성료",https://www.wikitree.co.kr/articles/814595,완도해양경찰서 박상환 경정은 “미래 해양교통의 공간적·운영방식 등의 변화에 따른 대비전략 마련에 대한 소고”를 발표했다. 한국폴리텍대학 전남캠퍼스 고무일 교수는 “선박 탄소배출 개선을 위한 밸브 조정 당... 
"전남도, 폭력피해 구제 네트워크 구축",http://www.bzeronews.com/news/articleView.html?idxno=539205,"이날 행사에는 여성폭력 피해자 지원시설 대표 40여 명과 22개 시군 업무담당자, 전남경찰청을 비롯한 21개 지역경찰서 여성폭력 전담 경찰관(APO) 등 80여 명이 참석했다. 연찬회는 &apos;폭력피해자 대응능력 강화 교육과 토론... "
전남 무안서 승용차 전복…40대 운전자 숨져,http://news.lghellovision.net/news/newsView.do?soCode=SCN0000000&idx=351291,"지난 주말 전남 무안에서 승용차가 전복돼 40대 운전자 한 명이 목숨을 잃는 사고가 발생했습니다. 11일 낮... 잇따라 들이 받았고, 현장에서 운전자 43살 A 씨가 숨졌습니다. 경찰은 정확한 사고 경위를 조사하고 있습니다."
[전남 주말 사건·사고 소식]전남 주말 사이 화재 속출…6살 어린이 숨져,http://news.lghellovision.net/news/newsView.do?soCode=SCN0000000&idx=351296,지난 주말 전남은 곳곳에서 발생한 화재로 얼룩졌습니다. 공장 화재가 소중한 어린 생명을 앗아갔고... 경찰은 아이가 질식한 것으로 추정하고 있지만 정확한 사인 규명을 위해 부검을 의뢰했습니다. ## 화면 전환 ## 10일... 
대형마트 화장실 숨어있다 억대 귀금속 털어…잡고 보니 이웃가게 주인,https://n.news.naver.com/mnews/article/421/0006514490?sid=102,"전남 여수경찰서는 야간건조물침입절도 혐의로 A씨(31)를 구속 기소의견으로 송치했다고 12일 밝혔다. A씨는 지난 2일 0시쯤 영업이 끝난 여수시 봉산동의 한 대형마트 금은방에 침입, 1억원 상당의 귀금속을 훔쳐... "
"경찰청, 섬 착륙불가 헬기장 개선...2024년까지 마무리",http://www.ifm.kr/news/349984,해양경찰청은 &apos;섬 응급환자 이송을 위한 헬기장 시설 개선 사업&apos;으로 정부혁신경진대회에서 행정안전부... 현재 전남 영광군 송이도와 인천 옹진군 자월도와 승봉도 헬기장 등 12곳이 개선돼 헬기가 착륙할 수 있게 됐고... 
"“3·1운동 이후 독립운동, 사회주의 배제하면 안 돼”[박주연의 메타뷰]",https://n.news.naver.com/mnews/article/033/0000044998?sid=004,1958년 전남 여수 출생이다. 옷장사를 하는 부모의 4남2녀 중 넷째다. 중학교까지 여수에서 다닌 후 1974년... 그런데 어느 날 제 자취방에 경찰들이 들이닥쳤어요. 동대문경찰서에 끌려가 며칠 동안 구타당하면서 자술서를... 
"전남도, &apos;폭력피해 구제 네트워크&apos; 구축",http://www.newsworker.co.kr/news/articleView.html?idxno=184687,"이날 행사에는 여성폭력 피해자 지원시설 대표 40여 명과 22개 시군 업무담당자, 전남경찰청을 비롯한 21개 지역경찰서 여성폭력 전담 경찰관(APO) 등 80여 명이 참석했다. 전라남도는 12일 목포 샹그리아비치 관광호텔에서... "
"전남도, 폭력피해 구제 네트워크 구축",http://www.siminsori.com/news/articleView.html?idxno=233610,"이날 행사에는 여성폭력 피해자 지원시설 대표 40여 명과 22개 시군 업무담당자, 전남경찰청을 비롯한 21개 지역경찰서 여성폭력 전담 경찰관(APO) 등 80여 명이 참석했다. 연찬회는 &apos;폭력피해자 대응능력 강화 교육과 토론... "
"해양경찰청 항공과, 행안부 장관상 수상...도서지역 헬기장 &apos;개선&apos;",https://www.asiatoday.co.kr/view.php?key=20221212010005741,해양경찰청는 최근 정부서울청사에서 개최된 &apos;제1회 민원의 날&apos; 행사에서 정부혁신경진대회 행정제도 개선 우수기관으로 선정돼 행정안정부장관상을 수상했다고 12일 밝혔다.해경청에 따르면 항공과는 지난해 전남... 
"해양경찰청, 2024년까지 착륙 불가 섬 헬기장 55개 개선",https://n.news.naver.com/mnews/article/011/0004132588?sid=102,해양경찰청 항공과는 섬 응급환자 이송을 위한 헬기장 시설 개선 사업으로 정부혁신경진대회 행정안전부... 올해 현재까지 전남 영광군 송이도와 인천 옹진군 자월도·승봉도 헬기장 등 12곳이 개선돼 헬기가 착륙할 수... 
‘이재명표’ vs ‘윤석열표’ 예산안 비교,https://www.ilyosisa.co.kr/news/article.html?no=237556,"야당은 대통령실 이전에 관한 비용과 행전안전부의 경찰국 신설 예산 등을 완강히 반대하고 있고, 여당은... 처음 도입된 2018년엔 고용산업 위기 지역으로 지정된 전북 군산, 경남 거제와 고성, 전남 영암에서... "
"해양경찰청 항공과, 정부혁신경진대회 행안부장관상 수상",https://n.news.naver.com/mnews/article/421/0006513940?sid=102,해양경찰청 항공과는 2021년 전남 신안군 등 전국 도서지역 헬기장 74개소에 대한 실태조사를 진행해 헬기착륙이 불가한 도서지역이 55개소인 것을 확인했다. 이에 해경청은 각 회전익항공대에 관할 도서지역 헬기장... 
"전남도, &apos;여성 안전 위한 민관경 연찬회&apos; 개최",http://www.enewstoday.co.kr/news/articleView.html?idxno=1622365,"이날 행사에는 여성폭력 피해자 지원시설 대표 40여 명과 22개 시군 업무담당자, 전남경찰청을 비롯한 21개 지역경찰서 여성폭력 전담 경찰관(APO) 등 80여 명이 참석했다. 연찬회는 &apos;폭력피해자 대응능력 강화 교육과 토론... "
"해경, 인천 옹진군 등 섬 응급헬기 착륙장 2024년까지 개선",http://www.incheontoday.com/news/articleView.html?idxno=224635,"인천투데이=이종선 기자 | 해양경찰청 항공과가 오는 2024년 완료를 목표로 추진 중인 응급환자 이송 헬기... 지난해 해경이 전남 신안군과 인천 옹진군 등 섬 지역 헬기장 74곳을 조사한 결과, 관리 부재로 조명등·풍향계... "
신안 가거도 갯바위서 50대 낚시객 실종…수색 이틀째,http://www.newspim.com/news/view/20221212000461, 전남 신안군 가거도에서 낚시하던 50대 남성이 실종돼 해경이 이틀째 수색 작업을 하고 있다. 12일 목포해양경찰서에 따르면 전날 오후 2시 21분께 신안군 가거도 3구 등대 근처 갯바위에서 50대 남성 A씨가... 
신안서 낚시하러 간 50대 남성 실종…해경 이틀째 수색,https://n.news.naver.com/mnews/article/421/0006513655?sid=102,전남 신안에서 낚시를 하러 나간 50대 남성이 실종돼 해경이 이틀째 수색작업을 벌이고 있다. 12일 목포해양경찰서에 따르면 전날 오후 2시21분쯤 신안군 가거도 3구 등대 인근 갯바위에서 낚시객 A씨가 실종됐다는... 
"전남도 자치경찰위, ‘풀뿌리 치안모델 만들기’",https://n.news.naver.com/mnews/article/382/0001021341?sid=102,조만형 전남자치경찰위원장은 “자치경찰제 성공을 위해서는 주민 참여가 필수적이다”며 “마을공동체를 통해 지역 치안서비스 만족도가 획기적으로 개선되도록 주민과 고민하고 이를 지원하겠다”고 말했다. 전남=
"해경청, 착륙 불가 섬 헬기장 55개 2024년까지 개선한다",https://n.news.naver.com/mnews/article/001/0013636596?sid=100,"섬 환자 헬기 이송 확대…항공과, 행안부 장관상 수상 해양경찰청 항공과는 섬 응급환자 이송을 위한 헬기장... 올해 현재까지 전남 영광군 송이도와 인천 옹진군 자월도·승봉도 헬기장 등 12곳이 개선돼 헬기가 착륙할... "
가거도 갯바위서 낚시하던 50대 실종…해경 수색,https://n.news.naver.com/mnews/article/001/0013636572?sid=102,12일 목포해양경찰서에 따르면 전날 오후 2시 21분께 전남 신안군 가거도 3구 등대 인근 갯바위에서 50대 남성 A씨가 실종됐다는 신고가 접수됐다. 타지역에서 온 A씨는 이날 오전 9시 30분께 갯바위 낚시를 한다며... 
"해양경찰청 항공과, 정부혁신경진대회 행안부 장관상 수상",https://www.dnews.co.kr/uhtml/view.jsp?idxno=202212121033333400685,해양경찰청 항공과는 서해 및 남해 도서지역에 거주하는 도서민들이 응급환자 발생 등 위급상황 발생 시 헬기이송 서비스를 제대로 받지 못하고 있는 점에 착안했다. 지난 2021년 전남 신안군 등 전국 도서지역 헬기장... 
[12일 오늘의사건사고] 한남대교 남단서 5중 추돌 사고 등,https://idsn.co.kr/news/view/1065576156739505,▲서울서초경찰서로고 (사진=서울서초경찰서) ◆한남대교서 BMW·택시 5중 추돌...3명 부상 12일 새벽 1시... 인명피해없어 12일 화순소방서에 따르면 이날 오후 3시22분경 전남 화순군 이양면 한 목재펠릿 생산 공장에서... 
[11일 오늘의 사건사고] 경남 창원서 SM5 승용차 잠든 해군 장교 입건 등,https://idsn.co.kr/news/view/1065575460969684,"옥천읍, 전남 무안군 무안읍, 경북 문경시 흥덕동, 인천시 연수구 옥련동 등에서 화재· 사고등이 발생했다. ▲경남경찰청로고 (사진=경남경찰청) ◆도로에서 잠든 해군 장교...음주 측정 거부로 체포 11일 새벽 1시경... "
무안서 승용차가 가로수 들이받고 전복…40대 운전자 숨져,https://n.news.naver.com/mnews/article/005/0001572653?sid=102,12일 무안경찰서에 따르면 전날 낮 12시45분쯤 전남 무안군의 한 도로 곡선 구간에서 A씨(43)가 몰던 승용차가 중앙선을 넘어 가로수와 암벽을 잇달아 들이받았다. 이 사고로 승용차가 전복되고 운전자 A씨가 현장에서... 
[10일 오늘의사건사고] 경기도 시흥시 건축 자재점 화재 등,https://idsn.co.kr/news/view/1065574298476211,"팔달구, 전남 담양군 창평시장,  서울 내부순환로 홍지문터널 부근 도로, 전북 진안군 용담호 등에서... ◆양평서 고교생 4명 탄 승용차 전신주 들이받아...2명 사망 10일 경찰에 따르면 이날 새벽 4시 10분경 경기도... "
전남 무안서 경차 가로수·암벽 충돌… 운전자 숨져,https://n.news.naver.com/mnews/article/366/0000861513?sid=102,12일 전남 무안경찰서에 따르면 지난 11일 오후 12시46분쯤 무안군 무안읍 성동리 한 도로에서 A(42)씨가 몰던 경차가 중앙선을 침범해 가로수와 암벽을 들이받았다. 이 사고로 경차가 심하게 파손됐으며 A씨는 현장에서... 
무안서 경차가 가로수·암벽 들이받아…40대 운전자 숨져,https://n.news.naver.com/mnews/article/421/0006513084?sid=102,"12일 전남 무안경찰서에 따르면 전날 낮 12시46분쯤 무안군 무안읍 성동리 한 도로에서 A씨(42·여)가 몰던 모닝이 중앙선을 침범, 가로수와 암벽을 들이받았다. 이 사고로 경차가 심하게 파손됐고 A씨는 현장에서 숨졌다.... "
무안서 경차 가로수·암벽 충격…40대 운전자 숨져,https://www.sisa-news.com/news/article.html?no=224136," 전남 무안군 한 간선 도로에서 40대 경차 운전자가 가로수와 암벽을 들이받는 사고로 숨졌다. 12일 무안경찰서에 따르면, 지난 11일 낮 12시 46분경 무안군 몽탄면 811번 지방도(편도 1차선 도로)에서 A(43·여)씨가 몰던... "
더불어민주당 역대 당대표 100일 취임 기자회견은? [데이터뉴스],http://www.sisaon.co.kr/news/articleView.html?idxno=145576,"이후 9월에 박주선 의원, 박준영 전 전남지사가 탈당하면서 분당이 본격적으로 시작됐다. 때문에, 문 대표... 공수처와 경찰법을 포함한 민생을 강조한 바 있다. 당시 과제를 워드클라우드를 통해 주요 키워드로 살펴본다.... "
무안서 경차 가로수·암벽 충격…40대 운전자 숨져,https://n.news.naver.com/mnews/article/003/0011586460?sid=102,"전남 무안군 한 간선 도로에서 40대 경차 운전자가 가로수와 암벽을 들이받는 사고로 숨졌다. 12일 무안경찰서에 따르면, 지난 11일 낮 12시 46분께 무안군 몽탄면 811번 지방도(편도 1차선 도로)에서 A(43·여)씨가 몰던... "
무안서 승용차 전복…40대 운전자 숨져,http://www.namdonews.com/news/articleView.html?idxno=706792,11일 낮 12시 45분께 전남 무안군 무안읍 한 도로의 곡선 구간에서 A(43)씨가 몰던 승용차가 가로수를 들이받고 암벽을 잇달아 충격했다. 이 사고로 승용차가 완전히 뒤집히고 A씨가 현장에서 숨졌다. 경찰은 정확한... 
전남 무안서 승용차 전복…40대 운전자 숨져,https://n.news.naver.com/mnews/article/001/0013636073?sid=102,11일 낮 12시 45분께 전남 무안군 무안읍 한 도로의 곡선 구간에서 A(43)씨가 몰던 승용차가 가로수를 들이받고 암벽을 잇달아 충격했다. 이 사고로 승용차가 완전히 뒤집히고 A씨가 현장에서 숨졌다. 경찰은 정확한... 
"전북대 교수 연루 &apos;7,200배 수익&apos; 논란 새만금 풍력발전사업, 결국 철회...재...",http://www.jbsori.com/news/articleView.html?idxno=10201,"경찰 수사 의뢰, 사업자 허가심사 대폭 강화...새만금 재생에너지 전반 영향 미칠 듯 새만금 해상풍력단지... 국민의힘 정경희 의원(비례)은 지난 10월 12일 전남대학교에서 열린 국회 교육위원회 국정감사에서 김동원... "
“3·1운동 이후 독립운동 주축 사회주의 인정을”[박주연의 메타뷰](28),https://n.news.naver.com/mnews/article/033/0000044994?sid=102,1958년 전남 여수 출생이다. 옷장사를 하는 부모의 4남2녀 중 넷째다. 중학교까지 여수에서 다닌 후 1974년... 그런데 어느 날 제 자취방에 경찰들이 들이닥쳤어요. 동대문경찰서에 끌려가 며칠 동안 구타당하면서 자술서를... 
전남 영암서 농막 화재...&quot;쓰레기 소각 불씨 번진 듯&quot;,https://n.news.naver.com/mnews/article/052/0001824525?sid=102,"어제저녁(11일) 8시 10분쯤 전남 영암군 시종면의 농막에서 불이 나 50분 만에 꺼졌습니다. 다친 사람은 없었지만, 24㎡ 규모의 컨테이너 구조 농막이 모두 타면서 소방서 추산 110만 원의 피해가 났습니다. 경찰과... "
&apos;윤석열표&apos; vs &apos;문재인표&apos;… 예산 확보하려는 與 깎으려는 野,https://n.news.naver.com/mnews/article/022/0003763296?sid=100,"정부부처와 관련해선, 법무부 인사정보관리단과 행정안전부 경찰국에 인건비 차원 예산을 지급해야 한다는... 전남 나주시 빛가람동 한국전력공사. 뉴시스 한전은 재무위기를 극복해 전력 공급 차질을 막으려면 한전채... "
울산 울주군 곰 탈출 인명사고…사전에 막을 수 없었나,http://www.ksilbo.co.kr/news/articleView.html?idxno=955564,9일 경찰이 사고농장을 폐쇄하고 있다. 김동수기자 dskim@ksilbo.co.kr 지난 8일 밤 울산 울주군에 위치한 곰... 2024년까지 전남 구례에 사육 곰 보호시설을 설치하기로 했다. 한편 환경부는 이번 사고가 발생한 지 하루 뒤인... 
12월12일 알림,https://n.news.naver.com/mnews/article/028/0002618756?sid=102,◇ 경찰청은 9일 중국 보이스피싱 콜센터 운영자 53명을 검거한 정민철 경기북부경찰청... ◇ BGF리테일은 9일 식수난을 겪고 있는 전남 완도군에 생수 6천여개를 긴급 지원했으며 추가 지원방안을 고려할 계획이다.... 
"울산, 또 탈출한 곰… 끝내 &apos;인명피해&apos;로 이어져",http://www.ujeil.com/news/articleView.html?idxno=317914,9일 경찰이 농장 출입문을 폐쇄하고 있다. 최지원 기자 울산의 한 곰 사육농장에서 탈출한 곰 3마리가 농장주... 그나마 환경부가 곰 사육 종식을 위해 전남 구례에 사육 곰 보호시설을 2024년까지 설치하는 사업을 현재... 
KH그룹 의혹·‘알펜시아’ 함께 조준… 야권 인사 겨냥 檢수사 확대,https://n.news.naver.com/mnews/article/081/0003323964?sid=102,"1980년대 전남 목포시에서 결성된 수노아파는 2000년대 들어 전국 10대 조폭으로 세력을 불렸다고 한다. 당시... 경찰은 올 초 수노아파 조직원들을 업무방해, 범죄단체조직 혐의로 불구속 송치했지만 검찰은 직접... "
주말 전남서 화재 잇따라…어린이 1명 숨져,http://www.kjdaily.com/article.php?aid=1670758208590808005,주말사이 전남 곳곳에서 화재가 발생하면서 인명과 재산피해가 잇따랐다. 11일 전남소방본부에 따르면 전날... 소방관과 경찰 등 277명과 물탱크를 포함한 장비 35대를 동원해 30여분만에 큰불을 잡고 대응 단계를... 
혼자 잠자던 6세 자녀 화재로 참변,https://kizmom.hankyung.com/news/view.html?aid=202212118590o,지난 10일 전남 장흥경찰서와 소방본부에 따르면 전날 오후 8시 29분쯤 장흥군 장흥읍 한 식품가공업체 공장에서 불이 났다. 불은 25분 만에 진화되었으나 공장 2층 거주 공간에서 잠을 자던 업체 대표의 6세 막내딸 A양이... 
도로교통공단 ‘교통문화 한마음 대축전’ 성료,http://www.kjdaily.com/article.php?aid=1670754800590749062,"올해로 42회를 맞은 행사에는 강기정 광주시장, 임용환 광주경찰청장, 고범석 전남경찰청 자치경찰부장, 정윤수 전남도 도로교통과장을 비롯한 교통유관 기관장들과 박남규 광주모범운전자연합회장, 곽뢰성... "
“미리 크리스마스”…‘불 밝힌 축제장’ 안전은 필수,https://n.news.naver.com/mnews/article/449/0000239719?sid=102,"&quot; 어제만 1만 명, 오늘 저녁까지 3만 명이 참여했는데, 구청 안전요원과 경찰관 등 100명이 안전관리를 위해... [정연서 정예서 / 전남 광양시] &quot;벌써 크리스마스 분위기가 나고 신나요. 따뜻해서 밖에 나가기 싫어요.&quot; 2주... "
장흥 공장 화재 6세 여아 사망…담양·해남서도 잇단 불,http://www.kwangju.co.kr/article.php?aid=1670752800746527006,장흥의 공장에서 불이나 6세 여자아이가 사망하는 등 주말사이 전남 곳곳에서 화재로 사상자가 발생했다. 장흥경찰은 “지난 9일 밤 8시 30분께 장흥군 장흥읍의 식품가공공장에서 화재가 발생해 2층 숙소에서 잠을... 
전남 곳곳서 화재…창평시장 점포 소실,http://www.jndn.com/article.php?aid=1670751296350551005,주말 사이 전남지역 곳곳에서 화재 사고가 잇따랐다. 11일 담양소방서 등에 따르면 지난 10일 오전 8시 7분께... 소방관과 경찰 등 277명과 물탱크를 포함한 장비 35대를 동원해 30여 분만에 큰불을 잡고 대응 단계를... 
남도일보 2022사회분야 10대 뉴스 (1)최악 가뭄 장기화...연초부터 심각성 예...,http://www.namdonews.com/news/articleView.html?idxno=706758,"바닥 드러낸 화순 동복호 광주·전남지역에 올해 초부터 이어진 극심한 가뭄으로 광주광역시의 제한급수가... 이른바 &apos;검수완박법 시행&apos;, &apos;경찰국 신설&apos; 등으로 검경이 격변을 맞게 됐다. 신종 코로나바이러스 감염증... "
"“해직사건 인권침해, 정부가 공식 사과해야”",http://www.jndn.com/article.php?aid=1670751217350538005,"11일 전국교직원노동조합 광주·전남지부(이하 노조)에 따르면 노조는 최근 성명서를 통해 “진실화해위원회는 전교조 결성 전후로 안기부의 총괄 기획 아래 문교부, 법무부, 보안사령부, 경찰 등 11개 국가기관이 총동원돼... "
잇단 화재 발생…전남 곳곳 생채기(종합),http://www.namdonews.com/news/articleView.html?idxno=706754,경찰과 소방당국은 가정용 가스 설치 과정에서 불이 난 것으로 보고 정확한 사고 경위를 조사 중이다. 또 전남 담양의 전통시장에서 장날 불이 나 다수 점포가 잿더미로 변했다. 같은날 오전 8시 7분께 전남 담양군... 
"檢, 조폭 난동 수사하다 ‘수상한 자금 흐름’ 추적…연결고리 확대되나",https://n.news.naver.com/mnews/article/081/0003323943?sid=102,"1980년대 전남 목포시에서 결성된 수노아파는 2000년대 들어 전국 10대 조폭으로 세력을 불렸다고 한다. 당시... 경찰은 올 초 수노아파 조직원들을 업무방해, 범죄단체조직 혐의로 불구속 송치했지만 검찰은 직접... "
화물연대 복귀 첫 주말 … 철강·석화 출하량 정상화,https://n.news.naver.com/mnews/article/009/0005058533?sid=102,"항만 물동량 평시 수준 회복 강원 시멘트 출하량 152% 경찰, 운송방해 60명 수사 화물연대가 총파업 개시 16일... 매일 철강 1만7000t이 제철소 안에 쌓였던 전남 광양제철소는 파업이 끝나 화물기사들이 복귀하면서... "
남도일보 사진뉴스,http://www.namdonews.com/news/articleView.html?idxno=706703,"/광주 남구 제공 여수공고, 이웃사랑 실천 전남 여수공고 31명의 학생들은 최근 학교 인근 지역인 동문동 일대의 경제적으로 어려움을 겪고 있는 이웃들을 대상으로 쌀, 마스크 등을 전달했다. /여수공고 제공 동부경찰서... "
파업은 끝났지만…화물연대 조사는 &apos;진행형&apos;,https://n.news.naver.com/mnews/article/422/0000574099?sid=101,"지역별로는 부산이 14명으로 가장 많았고, 경북이 11명, 전남이 6명 등으로 뒤를 이었습니다. 서울의 한 조합원은 업무개시 명령을 받고도 화물차 운행을 하지 않아 경찰에 고발되기도 했습니다. 공정거래위원회도 조사에... "
도시 전체가 문화재… 관광 산업 부흥이 과제 &lt;51&gt; 경북 경주시,http://www.skyedaily.com/news/news_view.html?ID=176139,김석기는 경찰관 출신으로 보수 정부에서 다양한 공직을 두루 거치며 정치인으로 성장했다.... 65% △전남 목포시 1.53% △대전광역시 유성구 1.02% △울산광역시 동구 0.8% △부산광역시 해운대구 0.08%보다 높다.... 
"신안군, 청소년복지 실무위원회 4차 정기회의 성료",http://www.namdonews.com/news/articleView.html?idxno=706680,"/신안군 제공 전남 신안군은 최근 신안군가족센터 교류소통공간실에서 신안교육지원청(Wee센터), 목포경찰서, 신안군드림스타트, 신안군가족센터, 신안군지역사회보장협의체, 신안군정신건강지원센터, 압해파출소... "
"[안전 광주, 나로부터] ①이태원 교훈...시험대 선 &apos;군중 관리&apos;",https://n.news.naver.com/mnews/article/003/0011585480?sid=102,"광주·전남 희생자만도 광주 7명, 전남 3명 등 모두 10명에 달했다. 정규직 전환, 첫 승진을 축하하려다 생을... 소방, 경찰, 지자체 공무원 배치와 역할 분담이 빈틈없이 꼼꼼하게 이뤄져야 하고, 특히 소방차와 구급차를... "
&apos;모두 외출한 사이&apos; 홀로 잠든 6살 막내딸 화재로 숨져(종합),http://www.namdonews.com/news/articleView.html?idxno=706663,10일 전남 장흥경찰서에 따르면 전날 오후 8시29분께 장흥군 장흥읍 한 식품가공업체 공장 2층에서 불이 나 25분 만에 꺼졌다. 이날 불로 2층 숙소에서 잠자고 있던 A(6)양이 연기에 질식해 숨진 채 발견됐다. A양은 업체... 
해남 단독주택서 화재…집 주인 등 2명 화상,http://www.namdonews.com/news/articleView.html?idxno=706664,경찰과 119소방본부는 가정용 가스 설치 과정에서 불이 난 것이 아닌가 보고 정확한 사고 경위를 조사중이다. 10일 오후 1시 20분께 전남 해남군 송지면 한 단독주택에서 불이 났다. 이 불로 집주인과 가스공급업체... 
전남 장흥 공장 화재…숙소에 있던 6세 여아 숨져,https://n.news.naver.com/mnews/article/079/0003716155?sid=102,10일 전남경찰청 등에 따르면 지난 9일 오후 8시 30분쯤 전남 장흥군 장흥읍 한 공장 2층 숙소에서 불이 났다. 이 불로 숙소에서 혼자 잠을 자고 있던 A(6)양이 심정지 상태로 발견돼 병원으로 옮겨졌지만 숨졌다. 불은... 
엄마 차로 무면허 질주 10대…전신주 들이받아 2명 숨져,https://n.news.naver.com/mnews/article/055/0001019406?sid=102,"경찰은 탑승자 모두 음주상태는 아니었던 것으로 판단하고, 국과수에 차량 정밀감식을 의뢰해 정확한 사고 원인을 조사할 방침입니다. --- 건조한 날씨 속에 화재도 잇달았습니다. 오늘 오전 8시쯤에는 전남 담양군... "
부모 김장 간 사이 화재로 6살 아이 숨져,https://n.news.naver.com/mnews/article/214/0001240627?sid=102,"[전남 장흥경찰서 관계자] &quot;한쪽이 탄 곳이 냉장고가 있는데, (그곳에서) 발화로 추정되거든요‥&quot; 경찰은 국립과학수사연구원와 함께 내일 합동 감식을 벌여 정확한 화재 원인을 조사할 계획입니다. MBC뉴스 박종호입니다.... "
