Title,Link,Description
전남 순천 공사장서 60대 노동자 10미터 아래 추락해 숨져,https://n.news.naver.com/mnews/article/056/0011388437?sid=102,오늘(7일) 오후 1시 15분쯤 전남 순천시 해룡면의 한 공장 신축 공사 현장에서 63살 A 씨가 10미터 아래로 추락해 숨졌습니다. 경찰은 사고 당시 A 씨가 건물 상부에서 철제 구조물 조립 작업을 하다 발을 헛디뎌 추락한... 
"경찰청장, &apos;총경회의 주도&apos; 류삼영 중징계 요구... 내부 부글부글",https://n.news.naver.com/mnews/article/469/0000711733?sid=102,"이날 광주ㆍ전남 경찰직장협의회 회장단은 입장문을 통해 “시민감찰위가 경징계를 권고했지만, 청장은 중징계를 요구했다”며 “도저히 이해할 수 없는 상황”이라고 비판했다. 회장단은 중징계 방침 철회와 총경회의... "
[촛불로드]아따 엥간치 좀 하쇼잉 : 광주 촛불 집회 현장을 가다,http://www.ddanzi.com/758355854,"이곳 송정시장은 조신시대 때부터 수백 년의 역사를 가진 전남 서남부 지역 중심 상권이었다. 이곳 광주... 깃발을 선두로, 경찰 공무원분들의 보호 아래, 촛불 시민 행진 시작. 풍물 놀이패의 악기 소리가 광주 시내에... "
순천 화학제품공장 신축 현장서 60대 노동자 추락사,https://n.news.naver.com/mnews/article/003/0011581045?sid=102,7일 오후 1시 15분께 전남 순천시 해룡면 한 화학제품 생산 공장 신축 현장에서 노동자 A(63)씨가 10m 아래로 추락했다. 이 사고로 크게 다친 A씨가 병원으로 옮겨졌으나 숨졌다. 경찰은 A씨가 2인 1조로 지붕을 설치하던... 
전남 순천 공사장서 60대 노동자 추락해 숨져,https://n.news.naver.com/mnews/article/032/0003191426?sid=102,7일 경찰에 따르면 이날 오후 1시 15분쯤 전남 순천시 해룡면의 한 공장 신축공사 현장에서 노동자 A씨(63)가 철근 작업을 하던 중 추락해 숨졌다. 사고 당시 A씨는 2인 1조로 철근 작업을 하던 중 안전고리를 풀고... 
순천 공사장 철근작업 60대 10m 아래로 추락해 숨져,https://n.news.naver.com/mnews/article/421/0006506755?sid=102,7일 전남 순천경찰서 등에 따르면 이날 오후 1시15분쯤 순천시 해룡산단의 한 공장 신축 공사 현장에서 A씨(62)가 철근 작업 중 10m 아래로 추락했다. 이 사고로 A씨는 병원으로 옮겨졌지만 숨졌다. 경찰은 A씨가 2인 1조로... 
전남 순천 신축 공사장 11m 높이서 철근 작업하던 60대 추락사,https://n.news.naver.com/mnews/article/448/0000385684?sid=102,오늘(7일) 오후 1시 15분 전남 순천시 율촌산업단지 내 신축 공사 현장에서 60대 작업자가 추락해 숨졌다. 경찰은 63살 A씨가 철근 작업을 하다 11m 높이에서 떨어진 것으로 보고 있다. 경찰은 공사 관계자와 목격자 등을... 
"영산강환경청, 뱀 4100여 마리 냉동보관 밀렵꾼 잡았다",https://n.news.naver.com/mnews/article/003/0011581031?sid=102,환경청은 지난 6일 전남 장성군에서 야생동물 밀렵·밀거래 행위에 대해 민·관 합동 단속을 벌였다.... 환경청은 밀렵꾼을 야생생물 보호법 위반으로 경찰에 고발했다. 멸종 위기 야생생물을 포획할 경우 &apos;야생생물... 
순천 공사장서 철근 작업하던 60대 노동자 추락사,https://n.news.naver.com/mnews/article/031/0000715500?sid=102,전남 순천시 한 공장 신축공사 현장에서 철근 작업 중인 노동자가 추락사하는 사고가 발생했다. 7일... 옮겨졌으나 결국 숨졌다. 경찰은 공사 현장 관계자와 목격자 등을 상대로 정확한 사고 원인을 조사하고 있다.
"조합장선거, 또 공보·벽보만 보고 뽑으라고요?",http://www.idomin.com/news/articleView.html?idxno=812102,경남경찰청이 지난 5일 밝힌 제8회 전국동시지방선거 선거사범 수사 대상 434명 중 금품 향응 제공 유형은 20.... 김승남(더불어민주당·전남 고흥보성군) 국회의원은 2020년 대표발의한 두 차례 개정안에서 시군구... 
“류삼영 총경 중징계 철회” 촉구,http://www.jndn.com/article.php?aid=1670406581350376005,광주·전남 경찰직장협의회 회장단은 7일 “경찰국 신설 여론 수렴을 위해 전국 경찰서장 회의를 추진한 류삼영 총경에 대한 중징계 요구를 철회하라”고 요구했다. 회장단은 이날 입장문을 내 “조직 현안에 대한... 
순천 공사장서 철근 작업 중 60대 노동자 추락사,https://n.news.naver.com/mnews/article/001/0013629815?sid=102,7일 오후 1시 15분께 전남 순천시 해룡면의 한 공장 신축공사 현장에서 노동자 A(63)씨가 철근 작업 중 추락해... 경찰은 공사 현장 관계자와 목격자 등을 상대로 정확한 사고 원인을 조사하고 있다.
[사설]전남대 기술지주 &apos;접대비 의혹&apos; 수사 촉각,http://www.namdonews.com/news/articleView.html?idxno=706389,경찰이 전남대 산학협력단 기술지주회사의 유흥업소 접대비 유용 의혹에 대해 내사에 들어가 구체적인 집행 내역과 위법 사항이 밝혀질지 초미의 관심사다. 광주경찰청 반부패경제범죄수사대는 전남대 기술지주회사가... 
“류삼영 총경 중징계 말라”…지역 경찰 직장협의회 잇단 성명,https://n.news.naver.com/mnews/article/018/0005382667?sid=102,류삼영 총경(사진=연합뉴스) 광주·전남 회장단은 7일 오전 입장문을 통해 “조직 현안에 대한 경찰관들의 자유로운 의견 개진 통로를 폭넓게 보장하라”고 촉구했다. 그러면서 “당시 참석자들은 주말에 휴가를 내고... 
멸종위기 구렁이 등 야생동물 4000여 마리 냉동 보관한 60대 밀렵꾼,https://n.news.naver.com/mnews/article/448/0000385673?sid=102,영산강유역환경청은 60대 밀렵꾼 A씨를 이같은 혐의로 경찰에 고발했다고 오늘(7일) 밝혔다. 환경당국에 따르면 A씨는 전남 장성군 일대에서 멸종위기종 2급인 구렁이 등 뱀 4000여 마리를 불법 포획해 가공한 혐의를... 
"꽉 막혔던 광양항, 컨테이너 반출입으로 숨통 트여",https://n.news.naver.com/mnews/article/079/0003715195?sid=102,화물연대 파업 이후 꽉 막혔던 전남 광양항의 물동량이 파업 전 평시 수준을 회복했다. 7일... 및 경찰의 호송지원을 제공했다. ※CBS노컷뉴스는 여러분의 제보로 함께 세상을 바꿉니다. 각종 비리와 부당대우... 
화물연대 1400여명 광주시청서 결의대회…&quot;안전운임 일몰제 폐지하라&quot;,https://n.news.naver.com/mnews/article/421/0006506581?sid=102,"화물연대 광주본부는 7일 오후 광주 서구 광주시청 앞에서 조합원 1400여명(경찰 추산)이 참여한 가운데 &apos;투쟁... 파업 이틀째인 지난달 25일부터 시작된 로드탁송은 광산구 평동출하장과 전남 장성 물류센터, 전남 함평... "
"영산강환경청, 야생동물 4천여 마리 포획 밀렵꾼 고발",https://n.news.naver.com/mnews/article/056/0011388356?sid=102,"영산강환경청이 야생동물 4천여 마리를 불법 포획한 밀렵꾼을 경찰에 고발했습니다. 영산강유역환경청은 최근 전남 장성 일대에서 밀렵·밀거래 단속을 펼친 결과, 멸종위기종인 구렁이를 포함해 야생동물 4천 백여... "
화물연대 조합원 속속 복귀…일부 물류 회복세,https://www.jnilbo.com/view/media/view?code=2022120717070678556,"민주노총 공공운수 화물연대 파업에 참여했던 광주·전남지역 조합원들이 업무에 속속 복귀하면서 항만을... 정부의 시멘트 분야 업무개시명령 발동 후 광주시는 국토부, 경찰과 함께 합동현장조사를 실시했다.... "
밀렵꾼 냉동창고 보니…불법 포획 야생동물 4100여 마리 보관,https://n.news.naver.com/mnews/article/079/0003715190?sid=102,영산강유역환경청은 전남 장성군 일대에서 불법 밀렵 행위를 일삼은 60대 남성 A씨를 야생생물보호법(야생생물 보호 및 관리에 관한 법률) 위반 혐의로 경찰에 고발했다고 7일 밝혔다. 조사 결과 A씨는 멸종위기종 2급... 
"&quot;광주시, 5·18 구묘역 성역화사업 졸속 추진&quot;(종합)",https://n.news.naver.com/mnews/article/003/0011580884?sid=102,"광주전남추모연대에 따르면 시립묘지 내 3묘역에 위치한 5·18 구 묘역은 1980년 5·18 당시 신군부의 총칼에 숨진 희생자들이 처음 안장된 곳이다. 1987년 6월 항쟁의 기폭제가 된 이한열 열사를 비롯, 2015년 11월 14일 경찰의... "
화물연대 총파업 2주째…흔들리는 대오 속 철강 출하 재개(종합),https://n.news.naver.com/mnews/article/001/0013629632?sid=102,이날 오전 10시 기준 전남 광양항의 컨테이너 반출입량은 3천760TEU(1TEU는 20피트 컨테이너 1개)로 평시... 경찰은 만일의 사태에 대비해 성신양회와 한일시멘트와 단양공장 주변에 820여명의 경비인력을 배치했다. 건설노조... 
목포농협 조합장 횡령 등 혐의 고발당해,http://www.namdonews.com/news/articleView.html?idxno=706346,"목포농협 일부 조합원등이 현 목포농협 조합장을 횡령 등 혐의로 고발한 것과 관련, 늦어지는 경찰 수사를 항의하는 기자회견을 하고 있다. /독자제공 전남 목포농협 일부 조합원 등이 현 목포농협 조합장을 횡령 등... "
광양항 반출입량 평시 대비 117%↑…철강·석유·화학 물류수송 회복(종합),https://n.news.naver.com/mnews/article/421/0006506570?sid=102,"민주노총 화물연대 총파업 장기화로 물류 수송에 차질을 빚었던 전남 광양항과 포스코 광양제철소... 노조 관계자는 &quot;파업 철회는 아니다&quot;며 &quot;지자체, 경찰과 마찰을 최소화하기 위한 조치였고 재정비를 통해 투쟁에... "
멸종위기 구렁이 등 뱀 4000마리 불법 포획·가공한 밀렵꾼 적발,https://n.news.naver.com/mnews/article/032/0003191411?sid=102,영산강유역환경청은 전남 장성군 일원에서 밀렵과 밀거래 행위를 일삼은 60대 A씨를 야생생물보호법 위반 혐의로 경찰에 고발했다고 7일 밝혔다. A씨는 야생생물관리협회와 동물단체 비글구조네트워크 등 민관 합동... 
&apos;봉지마다 뱀이 득실&apos;…구렁이 등 뱀 4천마리 냉동보관 전문 밀렵꾼 적발,http://www.namdonews.com/news/articleView.html?idxno=706336,"영산강유역환경청(영산강청)은 지난 6일 전남 장성군 북하면의 한 주택에서 뱀 4천여 마리를 냉동보관하고 있던 60대 A씨를 적발, 야생생물보호법 위반 혐의로 경찰에 고발했다고 7일 밝혔다. 영산강청은... "
"광주전남 경찰직장협, &quot;류삼영 총경 징계 철회하라&quot;",https://kjmbc.co.kr/article/B0Gr85VbOjLKv8KjPTkF,류 총경은 행정안전부 경찰국 신설을 앞둔 지난 7월 경찰 내부 의견 수렴을 위한 회의를 추진했습니다. #광주경찰청 #전남경찰청 #경찰직장협의회 #경찰국 #류삼영 #윤희근근
구렁이 등 뱀 4000마리 잡은 전문 밀렵꾼 적발,https://n.news.naver.com/mnews/article/016/0002075405?sid=102,영산강유역환경청은 전남 장성군 일원에서 밀렵을 일삼은 60대 남성 A씨에 대해 야생생물보호법 위반 혐의로 경찰에 고발했다고 7일 밝혔다. A씨의 밀렵 행위는 전날 야생생물관리협회와 동물단체 비글구조네트워크 등... 
멸종위기종 2급 구렁이 등 뱀 4000여마리 포획한 밀렵꾼 적발,https://n.news.naver.com/mnews/article/022/0003761969?sid=102,영산강유역환경청은 전남 장성군 일원에서 밀렵을 일삼은 60대 남성 A씨를 야생생물보호법 위반 혐의로 경찰에 고발했다고 7일 밝혔다. A씨의 밀렵 행위는 전날 야생생물관리협회와 동물단체 비글구조네트워크 등 민관... 
헉 이럴수가…뱀 4천마리 불법포획 냉동보관 &apos;덜미&apos;,http://www.pinpointnews.co.kr/news/articleView.html?idxno=160129,7일 영산강유역환경청은 야생생물보호법 위반 혐의로 전남 장성군 일원서 불법밀렵을 한 60대 A씨를 경찰에 고발했다고 밝혔다. A씨는 전날 야생생물관리협회와 동물단체 비글구조네트워크 등 민관 합동 단속에서... 
"광주·전남 경찰직장협 &quot;윤 청장, 류삼영 총경 징계 철회해야&quot;",https://www.jnilbo.com/view/media/view?code=2022120716322920326,광주·전남 경찰직장협의회(직협)가 행정안전부의 경찰국 설치에 대한 경찰 내부 의견을 수렴했던 류삼영 총경에 대한 중징계 철회를 공식적으로 요구하고 나섰다.직협은 7일 입장문을 내고 &quot;경찰청은 8일 경찰국 신설... 
"목포농협 일부 조합원, &apos;뇌물수수 혐의&apos; 등 조합장 고발",https://n.news.naver.com/mnews/article/001/0013629476?sid=101,"조합장 &quot;내년 선거와 관련된 비방 목적 루머&quot; 반박 전남 목포농협의 일부 조합원 등이 조합장을 횡령 등의 혐의로 고발했다. 목포농협 조합원과 준조합원, 퇴직동우회원 등은 7일 오후 2시 목포경찰서 앞에서 기자회견을... "
"힘 못 쓰는 화물연대, 파업 동력 꺾인 이유는 &apos;배부르기&apos; 때문?",http://www.pennmike.com/news/articleView.html?idxno=59103,정부는 7일 업무개시명령을 따르지 않은 미복귀자 시멘트 화물차 기사 1명을 경찰에 고발하고 지자체에... 민노총 공공운수 노조 화물연대 전남지역본부 조합원들도 광양항에서 속속 업무에 복귀하고 있다. 1996년... 
구렁이 등 뱀 4천마리 냉동보관…전문 밀렵꾼 적발,https://n.news.naver.com/mnews/article/001/0013629418?sid=102,영산강유역환경청은 전남 장성군 일원에서 밀렵을 일삼은 60대 남성 A씨에 대해 야생생물보호법 위반 혐의로 경찰에 고발했다고 7일 밝혔다. A씨의 밀렵 행위는 전날 야생생물관리협회와 동물단체 비글구조네트워크 등... 
기아 &apos;로드탁송 SUV&apos; 사고 잇달아…글로비스 &quot;사고 경위 공개의무 없어&quot;,https://n.news.naver.com/mnews/article/421/0006506411?sid=102,두 차량 모두 경찰 사건 접수가 아닌 &apos;보험 처리&apos;하기로 했다. 해당 차량들은 민간 탁송기사가 생산지에서부터 직접 차량을 운전해 목적지인 수출항까지 개별 운송하는 &apos;로드탁송&apos; 방식으로 전남 목포항으로 향하던... 
[이슈대담]이재용 &quot;중동은 기회의 땅&quot;…UAE 바라카 원전 건설 현장 찾아,http://www.nbntv.kr/news/articleView.html?idxno=65351,네 경찰과 노동계에 따르면 화물연대 집단운송거부 14일째인 어제 10시 화물연대 총파업 전남 거점지역인 광양항 컨테이너 터미널 인근에서는 전남지역본부 조합원들이 농성 중이었던 노조 천막 50여 개의 철거작업을... 
&apos;쇠구슬·라이터·마이크 투척&apos;… 경찰 &quot;화물연대 불법행위 전원 사법조치&quot;,http://www.m-i.kr/news/articleView.html?idxno=970298,서울 영등포구 국회 인근에 설치된 민주노총 전국금속노동조합의 국회 포위 농성장 앞에서 경찰들이... 전남에서도 파업에 참여하지 않은 차량의 운행을 방해하고 비조합원을 폭행한 화물연대 조합원 5명이 잇달아... 
"8개국 해양치안기관 공무원, 해경교육원서 연수",http://www.namdonews.com/news/articleView.html?idxno=706293,"7일 호주, 나이지리라 등 8개국 해안치안 공무원이 전남 여수의 해경교육원에서 연수를 하고 있다./해경교육원 제공 해양경찰교육원은 우리나라와 국제공조관계를 맺고 있는 외국해양치안기관 공무원을 대상으로 해양... "
"타지역보다 작은 광양항, 파업 여파는 가장 길어",https://n.news.naver.com/mnews/article/001/0013629176?sid=101,"석유화학·철강 수출입 기지, 화물연대 파업 역량 집중 조합원 많고 파업 참여율 높아…지역 경찰력 한계도 원인 화물연대 파업으로 전남 광양항의 기능이 장기간 마비되면서 국내 주요 수출입 기지인 광양항이 주목받고... "
[영상]봉지마다 뱀이 득실..멸종위기종 등 냉동보관한 60대,https://n.news.naver.com/mnews/article/660/0000023521?sid=102,"영산강유역환경청과 야생생물관리협회 광주전남지부, 동물단체 비글구조네트워크는 합동단속을 통해 지난... 통발을 모두 폐기했습니다. 경찰은 A씨를 야생생물보호 및 관리에 관한 법률 위반 혐의로 조사하고 있습니다."
광주·전남 경찰직장협의회 &quot;류삼영 총경 중징계 철회해야&quot;,https://n.news.naver.com/mnews/article/660/0000023513?sid=102,"경찰국 신설에 반대하며 전국 경찰서장 회의를 주도한 류삼영 총경에 대한 징계 결정이 하루 앞으로 다가온 가운데, 광주·전남 경찰직장협의회가 중징계 철회를 요구하고 나섰습니다. 광주·전남 경찰직장협의회 회장단은... "
"광주전남 경찰직장협, &quot;류삼영 총장 징계 철회&quot;",https://kjmbc.co.kr/article/HhOoPu9lmU_FZhbgi3EW,류 총경은 행정안전부 경찰국 신설을 앞둔 지난 7월 경찰 내부 의견 수렴을 위한 회의를 추진했습니다. #광주경찰청 #전남경찰청 #경찰직장협의회 #경찰국 #류삼영 #윤희근근
광주전남 경찰직장협 &quot;류삼영 총경 징계 요구 철회해야&quot;,http://www.namdonews.com/news/articleView.html?idxno=706283,류삼영 총경./연합뉴스 광주·전남 경찰직장협의회 회장단은 7일 &quot;경찰국 신설 여론 수렴을 위해 전국 경찰서장 회의를 추진한 류삼영 총경에 대한 중징계 요구를 철회하라&quot;고 요구했다. 회장단은 이날 입장문을 내 &quot;조직... 
광주전남경찰직장협의회 &quot;류삼영 총경 중징계 철회를&quot;,https://n.news.naver.com/mnews/article/421/0006505886?sid=102,광주전남경찰직장협의회가 행정안전부의 경찰국 설치에 대한 경찰 내부 의견을 수렴했던 류삼영 총경에 대한 중징계 철회를 공식적으로 요구하고 나섰다. 광주전남경찰직장협의회는 7일 입장문을 통해 &quot;경찰청은 8일... 
극단 파도소리 &apos;풍물시장 여간첩&apos; 공연,http://www.netongs.com/news/articleView.html?idxno=311806,"국밥집을 자주 찾는 안 박사와 장 씨, 김 씨 사이에서는 간첩으로 보이는 여주인을 경찰에 신고해야 한다며... 극단 &apos;파도소리&apos;는 1987년 창단 이후 그간 250여 회의 공연과 미국 5개주 순회 공연, 전국 연극제, 전남... "
광주전남 경찰직장협 &quot;류삼영 총경 징계 요구 철회해야&quot;,https://n.news.naver.com/mnews/article/001/0013628756?sid=102,광주·전남 경찰직장협의회 회장단은 7일 &quot;경찰국 신설 여론 수렴을 위해 전국 경찰서장 회의를 추진한 류삼영 총경에 대한 중징계 요구를 철회하라&quot;고 요구했다. 회장단은 이날 입장문을 내 &quot;조직 현안에 대한 경찰관들의... 
"광주 광산구, &apos;5·18 사적지 지정을 위한 포럼&apos; 개최",https://www.jnilbo.com/view/media/view?code=2022120710105219245,"가두방송에 나선 차명숙씨, 도청 최후 항쟁 당시 상황을 방송한 박영순씨 등이 증언자로 나서 광산경찰 구금 당시를 설명했다.광주송정역은 1980년 5월22일 광주·전남 시위 군중이 집결했던 곳으로, 계엄군의 만행을... "
화물연대 총파업 2주째…흔들리는 대오에 물류 흐름 회복세,https://n.news.naver.com/mnews/article/055/0001018585?sid=102,오늘 오전 10시 기준 전남 광양항의 컨테이너 반출입량은 3천760TEU(1TEU는 20피트 컨테이너 1개)로 평시... 경찰은 만일의 사태에 대비해 한일시멘트와 성신양회 주변에 820여 명의 경비인력을 배치했습니다. 성신양회와... 
여수 해경교육원서 8개국 해양치안 공무원 연수,https://n.news.naver.com/mnews/article/079/0003715011?sid=102,8개 나라 9명의 해양치안 공무원이 전남 여수 해양경찰교육원에서 해양 교육훈련 과정 연수를 받았다. 7일 여수해경교육원에 따르면 지난 5일부터 2박3일 동안 8개국 9명의 해양치안 공무원이 2022년 외국해양치안공무원... 
광양항 컨테이너 반출입량 100% 회복…물류 수송 정상화,https://n.news.naver.com/mnews/article/421/0006505611?sid=102,"민주노총 화물연대 총파업 여파로 물류 수송에 차질을 빚었던 전남 광양항이 평시 수준을 회복하면서... 노조 관계자는 &quot;&quot;파업 철회는 아니다&quot;며 &quot;지자체, 경찰과 마찰을 최소화하기 위한 조치였고 재정비를 통해... "
화물연대 총파업 2주째…흔들리는 대오에 물류 흐름 회복세,https://n.news.naver.com/mnews/article/001/0013628633?sid=102,이날 오전 10시 기준 전남 광양항의 컨테이너 반출입량은 3천760TEU(1TEU는 20피트 컨테이너 1개)로 평시... 경찰은 만일의 사태에 대비해 한일시멘트와 성신양회 주변에 820여명의 경비인력을 배치했다. 성신양회와... 
&apos;알박기 인사&apos; 지목된 한국농어촌공사… 감사원 감사에 국세청 세무조사 받아,http://www.metroseoul.co.kr/article/20221207500138,"7일 국회 산업통상자원중소벤처기업위원회 소속 김회재 의원(더불어민주당, 전남 여수시을)이... 한편, 감사원은 지난 6월 서해 공무원 피살사건과 관련해 국가안보실과 국방부, 해양경찰청 등에 대한 감사를 시작으로... "
"&apos;텍사스 홀덤&apos; 뭐길래…&quot;게임칩·경품 준 업주, 벌금형 타당하다&quot;",https://n.news.naver.com/mnews/article/008/0004826305?sid=102,"A씨는 일반음식점으로 등록한 전남 순천 자신의 주점에서 지난해 3월1일 딜러를 두고 &apos;텍사스 홀덤&apos; 게임을... 재판부는 &quot;&apos;포커를 계속 돌린다&apos;는 내용의 112 신고가 접수돼 경찰에 적발된 점, 판돈의 규모가 소액이라고 볼... "
"여수해경 조영훈 구조대장, 발명대회 상금 순직해경 유족에 전액 기부",https://n.news.naver.com/mnews/article/079/0003714902?sid=102,"국민안전 발명챌린지에서 입상한 전남 여수해경 소속 경찰관이 시상금 전액을 순직 해경 유가족에 기부했다. 7일 여수해경에 따르면 해양경찰청과 경찰청, 소방청, 특허청이 주최하는 국민안전 발명챌린지에서 동상을... "
여수서 80대 남성 경운기에 깔려 숨져,https://n.news.naver.com/mnews/article/079/0003714900?sid=102,전남 여수에서 80대 남성이 경운기에 깔려 숨지는 사고가 발생했다. 7일 여수경찰서에 따르면 전날 오후 1시 10분쯤 여수시 남면 한 야산 인근 밭에서 A(85)씨가 경운기에 깔려 있다는 신고가 접수됐다. 이 사고로 크게... 
[7일 오늘의사건사고] 대구 광역시 달서구 성서공단 공장서 화재 등,https://idsn.co.kr/news/view/1065572452338831,한편 경찰은 공사 현장 관계자와 목격자 등을 상대로 정확한 사고 원인을 조사중이다. ◆전남 고흥군 야산서 산불...진화중 7일 오후 4시 34분경 전남 고흥군 두원면 학곡리의 한 야산에서 화재가 발생했다. 산불 진화... 
전남 여수서 80대 남성 경운기에 끼여 숨져,https://n.news.naver.com/mnews/article/448/0000385578?sid=102,"경찰은 A씨가 경운기 전동 벨트에 옷자락이 끼이면서 사고가 난 것으로 추정하고 있다. 타살 혐의점은 발견되지 않았다, 경찰은 목격자 진술 등을 토대로 정확한 사고 원인을 조사 중이다."
14년차 유조차 운전 기사 “탱크로리 수입 좋아 안전 운임제 이유 없다? 어처...,https://n.news.naver.com/mnews/article/022/0003761830?sid=102,밀집한 전남 여수 국가산업단지에 운행을 중단한 정유차가 세워져 있다. 여수=연합뉴스 정부의 정유 분야 등... 비조합원들 차량에 돌 던진 화물연대 조합원들이 경찰에 연행됐다는 최근 언론 보도 등에는 “본인의... 
"광주시, 6일 화물연대 파업 민관합동 대책회의 개최",http://www.breaknews.com/937300,광주경찰청 등이 참여해 화물연대 운송거부에 따른 물류 피해 상황과 대체... continuing to increase due to the prolonged refusal to transport cargo.&quot; 원본 기사 보기:브레이크뉴스 전남
관광경찰 출범 1등 공신… 업무 역량 · 인품 겸비한 고위공무원,https://n.news.naver.com/mnews/article/021/0002545161?sid=102,옛전남도청복원추진단장이다. 얼마 전 미국에 살고 있는 한 지인과 안부 전화를 주고받았다. 그런데 같은 직장 동료가 두 달 전에 부산 여행을 다녀와서 “대한민국 관광경찰의 친절함과 최상의 치안서비스를 제공받은... 
